45,220,Friends am i right?,Humans are pack animals and your friends are largely your pack. You need them like you need a bath. They can be your greatest source of happiness and drive you crazy too!,friends.png,NULL,221,,"INSERT INTO FIX (order, heading, maintext, image, backvalue, nextvalue) VALUES (220, ""Friends am i right?"", ""Humans are pack animals and your friends are largely your pack. You need them like you need a bath. They can be your greatest source of happiness and drive you crazy too!"", ""friends.png"", ""NULL"", ""221"")",,,,,
46,221,Steam outlet!,"If you're really angry first off you need to release that pressure. If you have a healthy outlet (not beating up strangers in parking lots) then use it otherwise think of the following options: meditation, hard exercise, the far more realistic for you easy exercise or talking to someone. Do not use this as an excuse to backslide into distructive behaviour.",NULL,220,222,,"INSERT INTO FIX (order, heading, maintext, image, backvalue, nextvalue) VALUES (221, ""Steam outlet!"", ""If you're really angry first off you need to release that pressure. If you have a healthy outlet (not beating up strangers in parking lots) then use it otherwise think of the following options: meditation, hard exercise, the far more realistic for you easy exercise or talking to someone. Do not use this as an excuse to backslide into distructive behaviour."", ""NULL"", ""220"", ""222"")",,,,,
47,222,Analyse you,"Why are you angry? I know there is a surface thing but why did it effect you, hurt you. You are responsible for your emotions, nobody else so examine what broke your control - it's your issue and choice to be angry ultimately. Also are there any chemical imbalances? Missing coffee, sleep, exercise, intimacy? Be honest about the cause here.",NULL,221,223,,"INSERT INTO FIX (order, heading, maintext, image, backvalue, nextvalue) VALUES (222, ""Analyse you"", ""Why are you angry? I know there is a surface thing but why did it effect you, hurt you. You are responsible for your emotions, nobody else so examine what broke your control - it's your issue and choice to be angry ultimately. Also are there any chemical imbalances? Missing coffee, sleep, exercise, intimacy? Be honest about the cause here."", ""NULL"", ""221"", ""223"")",,,,,
48,223,Analyse them,Why did they act this way? Were they displacing another action (maybe from you?). Any other mitigating factors eg. she's PMSing like crazy. Do you think they can compromise? Do they have the maturity to do so?,NULL,222,224,,"INSERT INTO FIX (order, heading, maintext, image, backvalue, nextvalue) VALUES (223, ""Analyse them"", ""Why did they act this way? Were they displacing another action (maybe from you?). Any other mitigating factors eg. she's PMSing like crazy. Do you think they can compromise? Do they have the maturity to do so?"", ""NULL"", ""222"", ""224"")",,,,,
49,224,What do you want?,"Seriously what is your best case scenario here? Write it down - it's easy to forget when angry and you just want to crush the other person or win an argument. Be practical, realistic and recognise you'll probably have to compromise.",NULL,223,225,,"INSERT INTO FIX (order, heading, maintext, image, backvalue, nextvalue) VALUES (224, ""What do you want?"", ""Seriously what is your best case scenario here? Write it down - it's easy to forget when angry and you just want to crush the other person or win an argument. Be practical, realistic and recognise you'll probably have to compromise."", ""NULL"", ""223"", ""225"")",,,,,
50,225,Consider the pack,"Is what they're doing or saying truly risking your pack status? If so draw battle lines. Talk to your other friends as soon as possible, explain your side without lying or bitchiness and try to preempt them doing the same thing.",NULL,224,226,,"INSERT INTO FIX (order, heading, maintext, image, backvalue, nextvalue) VALUES (225, ""Consider the pack"", ""Is what they're doing or saying truly risking your pack status? If so draw battle lines. Talk to your other friends as soon as possible, explain your side without lying or bitchiness and try to preempt them doing the same thing."", ""NULL"", ""224"", ""226"")",,,,,
51,226,Let's talk...urgh,Only consider this if both of you are calm. If not wait till you both are. If you lose your temper when talking even a little you fail here - focus on control. Explain why you're angry (and hurt) and what you'd like to happen. Let that precious bitch moan back at you but stay on target. Bring the conversation back to a resolution and seek that compromise you were looking for. Shake/Apologise as needed.,NULL,225,227,,"INSERT INTO FIX (order, heading, maintext, image, backvalue, nextvalue) VALUES (226, ""Let's talk...urgh"", ""Only consider this if both of you are calm. If not wait till you both are. If you lose your temper when talking even a little you fail here - focus on control. Explain why you're angry (and hurt) and what you'd like to happen. Let that precious bitch moan back at you but stay on target. Bring the conversation back to a resolution and seek that compromise you were looking for. Shake/Apologise as needed."", ""NULL"", ""225"", ""227"")",,,,,
52,227,Still pissed/butt hurt,For the real grudge holders consider if malice was truly invovled. As a general rule thoughtlessness requires an apology but actual malice requires restitution. Accept that you might not get either depending on the craziness/maturity of the person.,NULL,226,228,,"INSERT INTO FIX (order, heading, maintext, image, backvalue, nextvalue) VALUES (227, ""Still pissed/butt hurt"", ""For the real grudge holders consider if malice was truly invovled. As a general rule thoughtlessness requires an apology but actual malice requires restitution. Accept that you might not get either depending on the craziness/maturity of the person."", ""NULL"", ""226"", ""228"")",,,,,
53,228,Be discerning!,This is really important: be careful who you pick as your friends! Who you choose will determine your success/failure/happiness etc in life. Hang out with spiders and you're going to catch flies for partners too. Learn that as much fun as it might be to watch Jim get into fights or Jill self destruct in drama each week that these people are toxic and will drag you under eventually. Cut them out of your life - they won't change.,NULL,227,229,,"INSERT INTO FIX (order, heading, maintext, image, backvalue, nextvalue) VALUES (228, ""Be discerning!"", ""This is really important: be careful who you pick as your friends! Who you choose will determine your success/failure/happiness etc in life. Hang out with spiders and you're going to catch flies for partners too. Learn that as much fun as it might be to watch Jim get into fights or Jill self destruct in drama each week that these people are toxic and will drag you under eventually. Cut them out of your life - they won't change."", ""NULL"", ""227"", ""229"")",,,,,
54,229,Calmed your tits?,"Look anger can be horrible but it can be a really great motivator too if harnessed. Use this situation to recognise what needs to change and the anger as fuel to get you off your (ever expanding) ass and make it happen. Go make a change, even if worst case that means losing a 'friend' or two.",smile.png,228,1,,"INSERT INTO FIX (order, heading, maintext, image, backvalue, nextvalue) VALUES (229, ""Calmed your tits?"", ""Look anger can be horrible but it can be a really great motivator too if harnessed. Use this situation to recognise what needs to change and the anger as fuel to get you off your (ever expanding) ass and make it happen. Go make a change, even if worst case that means losing a 'friend' or two."", ""smile.png"", ""228"", ""1"")",,,,,
55,230,Work Pricks,"This is really complicated. The perking order and pack status can be hard to read. Be cautious here - always be unemotional, professional and act like someone is constantly watching your actions - they are!",work.png,NULL,231,,"INSERT INTO FIX (order, heading, maintext, image, backvalue, nextvalue) VALUES (230, ""Work Pricks"", ""This is really complicated. The perking order and pack status can be hard to read. Be cautious here - always be unemotional, professional and act like someone is constantly watching your actions - they are!"", ""work.png"", ""NULL"", ""231"")",,,,,
56,231,Steam outlet!,"If you're really angry first off you need to release that pressure. If you have a healthy outlet then use it otherwise think of the following options: meditation, hard exercise, the far more realistic for you easy exercise or talking to someone - definitely not someone from work unless you want it to get around (it absolutely will). Do not use this as an excuse to backslide into destructive behaviour.",NULL,230,232,,"INSERT INTO FIX (order, heading, maintext, image, backvalue, nextvalue) VALUES (231, ""Steam outlet!"", ""If you're really angry first off you need to release that pressure. If you have a healthy outlet then use it otherwise think of the following options: meditation, hard exercise, the far more realistic for you easy exercise or talking to someone - definitely not someone from work unless you want it to get around (it absolutely will). Do not use this as an excuse to backslide into destructive behaviour."", ""NULL"", ""230"", ""232"")",,,,,
57,232,Analyse you,"Why are you angry? I know there is a surface thing but why did it effect you, hurt you. You are responsible for your emotions, nobody else so examine what broke your control - it's your issue and choice to be angry ultimately. Also are there any chemical imbalances? Missing coffee, sleep, exercise, intimacy? Be honest about the cause here.",NULL,231,233,,"INSERT INTO FIX (order, heading, maintext, image, backvalue, nextvalue) VALUES (232, ""Analyse you"", ""Why are you angry? I know there is a surface thing but why did it effect you, hurt you. You are responsible for your emotions, nobody else so examine what broke your control - it's your issue and choice to be angry ultimately. Also are there any chemical imbalances? Missing coffee, sleep, exercise, intimacy? Be honest about the cause here."", ""NULL"", ""231"", ""233"")",,,,,
58,233,Analyse them,Why did they act this way? Were they displacing another action (maybe from you?). Any other mitigating factors eg she's PMSing like crazy? Do you think they can compromise? Do they have the maturity to do so? Is this part of a work plot to keep you in your role or move you?,NULL,232,234,,"INSERT INTO FIX (order, heading, maintext, image, backvalue, nextvalue) VALUES (233, ""Analyse them"", ""Why did they act this way? Were they displacing another action (maybe from you?). Any other mitigating factors eg she's PMSing like crazy? Do you think they can compromise? Do they have the maturity to do so? Is this part of a work plot to keep you in your role or move you?"", ""NULL"", ""232"", ""234"")",,,,,
59,234,What do you want?,"Seriously what is your best case scenario here? Write it down - it's easy to forget when angry and you just want to crush the other person or win an argument. Be practical, realistic and recognise you'll probably have to compromise.",NULL,233,235,,"INSERT INTO FIX (order, heading, maintext, image, backvalue, nextvalue) VALUES (234, ""What do you want?"", ""Seriously what is your best case scenario here? Write it down - it's easy to forget when angry and you just want to crush the other person or win an argument. Be practical, realistic and recognise you'll probably have to compromise."", ""NULL"", ""233"", ""235"")",,,,,
60,235,Is it serious?,Is this a really big thing? Get advice from a lawyer immediately. You could talk to HR but as friendly as they seem remember their job is only to protect the company. They will always protect the higher ups over you too unless they are under legal stress.,NULL,234,236,,"INSERT INTO FIX (order, heading, maintext, image, backvalue, nextvalue) VALUES (235, ""Is it serious?"", ""Is this a really big thing? Get advice from a lawyer immediately. You could talk to HR but as friendly as they seem remember their job is only to protect the company. They will always protect the higher ups over you too unless they are under legal stress."", ""NULL"", ""234"", ""236"")",,,,,
61,236,Shift,"Get your resume ready and apply everywhere you can! It's a huge morale and confidence boost if nothing else. No matter what is happening at your current job, moving to a new one is almost certainly a better option. You will generally get better pay and benefits every time you shift and you should be turning down two jobs a year regardless of how happy you might be at your job.  Try not to shift in your first 6 months at a place though.",NULL,235,237,,"INSERT INTO FIX (order, heading, maintext, image, backvalue, nextvalue) VALUES (236, ""Shift"", ""Get your resume ready and apply everywhere you can! It's a huge morale and confidence boost if nothing else. No matter what is happening at your current job, moving to a new one is almost certainly a better option. You will generally get better pay and benefits every time you shift and you should be turning down two jobs a year regardless of how happy you might be at your job.  Try not to shift in your first 6 months at a place though."", ""NULL"", ""235"", ""237"")",,,,,
62,237,I mean it - go apply for jobs or I'll do something for real this time.,Apply for 6 jobs at least. Consider work in other cities you've always wanted to visit. Always ask for a 20% pay increase or more.,stab.png,236,238,,"INSERT INTO FIX (order, heading, maintext, image, backvalue, nextvalue) VALUES (237, ""I mean it - go apply for jobs or I'll do something for real this time."", ""Apply for 6 jobs at least. Consider work in other cities you've always wanted to visit. Always ask for a 20% pay increase or more."", ""stab.png"", ""236"", ""238"")",,,,,
63,238,Let's talk...professionally.,Only consider this if you are calm - bonus points if the other person is still angry - they might make critical mistakes. Conversely if you lose your temper when talking even a little you fail here - focus on control. Ask for your boss to be present if appropriate. Discuss the situation dispassionately and try to focus on solutions. Keep trying to bring it back to your preferred solution. You win if you get what you want or make the other person lose their cool by being composed.,NULL,237,239,,"INSERT INTO FIX (order, heading, maintext, image, backvalue, nextvalue) VALUES (238, ""Let's talk...professionally."", ""Only consider this if you are calm - bonus points if the other person is still angry - they might make critical mistakes. Conversely if you lose your temper when talking even a little you fail here - focus on control. Ask for your boss to be present if appropriate. Discuss the situation dispassionately and try to focus on solutions. Keep trying to bring it back to your preferred solution. You win if you get what you want or make the other person lose their cool by being composed."", ""NULL"", ""237"", ""239"")",,,,,
64,239,Calmed your tits?,It can be hard to find an adequate solution in work conflicts - it's hardly a fair environment so accept that. If you can't move forwards look at avoiding the toxic person/s either by applying to shift sideways (another department) or moving jobs - which is almost certainly the best option (the ungrateful pricks don't deserve you!).,smile.png,238,1,,"INSERT INTO FIX (order, heading, maintext, image, backvalue, nextvalue) VALUES (239, ""Calmed your tits?"", ""It can be hard to find an adequate solution in work conflicts - it's hardly a fair environment so accept that. If you can't move forwards look at avoiding the toxic person/s either by applying to shift sideways (another department) or moving jobs - which is almost certainly the best option (the ungrateful pricks don't deserve you!)."", ""smile.png"", ""238"", ""1"")",,,,,
65,240,Lover turned hater?,When you are so emotionally open to someone (like you are to a free buffet) it can be impossible not to be hurt easily. These steps should help!,partner.png,1,241,,"INSERT INTO FIX (order, heading, maintext, image, backvalue, nextvalue) VALUES (240, ""Lover turned hater?"", ""When you are so emotionally open to someone (like you are to a free buffet) it can be impossible not to be hurt easily. These steps should help!"", ""partner.png"", ""1"", ""241"")",,,,,
66,241,Get some perspective,"A common mistake is spending too much time together. If you are always together the other person subconsciously becomes the font of all things good in your life, but also all the bad and frustrations. Get out, talk to some friends, spend some time apart and get that perspective you've probably been missing (like being able to see your toes without bending).",NULL,240,242,,"INSERT INTO FIX (order, heading, maintext, image, backvalue, nextvalue) VALUES (241, ""Get some perspective"", ""A common mistake is spending too much time together. If you are always together the other person subconsciously becomes the font of all things good in your life, but also all the bad and frustrations. Get out, talk to some friends, spend some time apart and get that perspective you've probably been missing (like being able to see your toes without bending)."", ""NULL"", ""240"", ""242"")",,,,,
67,242,Steam outlet!,"If you're really angry first off you need to release that pressure. If you have a healthy outlet (not beating up strangers in parking lots) then use it otherwise think of the following options: meditation, hard exercise, the far more realistic for you easy exercise or talking to someone. Do not use this as an excuse to backslide into distructive behaviour.",NULL,241,243,,"INSERT INTO FIX (order, heading, maintext, image, backvalue, nextvalue) VALUES (242, ""Steam outlet!"", ""If you're really angry first off you need to release that pressure. If you have a healthy outlet (not beating up strangers in parking lots) then use it otherwise think of the following options: meditation, hard exercise, the far more realistic for you easy exercise or talking to someone. Do not use this as an excuse to backslide into distructive behaviour."", ""NULL"", ""241"", ""243"")",,,,,
68,243,Analyse you,"Why are you angry? I know there is a surface thing but why did it effect you, hurt you. You are responsible for your emotions, nobody else so examine what broke your control - it's your issue and choice to be angry ultimately. Also are there any chemical imbalances? Missing coffee, sleep, exercise, intimacy? Be honest about the cause here.",NULL,242,244,,"INSERT INTO FIX (order, heading, maintext, image, backvalue, nextvalue) VALUES (243, ""Analyse you"", ""Why are you angry? I know there is a surface thing but why did it effect you, hurt you. You are responsible for your emotions, nobody else so examine what broke your control - it's your issue and choice to be angry ultimately. Also are there any chemical imbalances? Missing coffee, sleep, exercise, intimacy? Be honest about the cause here."", ""NULL"", ""242"", ""244"")",,,,,
69,244,Analyse them,Why did they act this way? Were they displacing another action (maybe from you?). Any other mitigating factors eg. she's PMSing like crazy. Do you think they can compromise? Do they have the maturity to do so?,NULL,243,245,,"INSERT INTO FIX (order, heading, maintext, image, backvalue, nextvalue) VALUES (244, ""Analyse them"", ""Why did they act this way? Were they displacing another action (maybe from you?). Any other mitigating factors eg. she's PMSing like crazy. Do you think they can compromise? Do they have the maturity to do so?"", ""NULL"", ""243"", ""245"")",,,,,
70,245,What do you want?,"Seriously what is your best case scenario here? Write it down - it's easy to forget when angry and you just want to crush the other person or win an argument. Be practical, realistic and recognise you'll probably have to compromise.",NULL,244,246,,"INSERT INTO FIX (order, heading, maintext, image, backvalue, nextvalue) VALUES (245, ""What do you want?"", ""Seriously what is your best case scenario here? Write it down - it's easy to forget when angry and you just want to crush the other person or win an argument. Be practical, realistic and recognise you'll probably have to compromise."", ""NULL"", ""244"", ""246"")",,,,,
71,246,Let's talk...urgh,Only consider this if both of you are calm. If not wait till you both are. If you are married or have been together for a long time and this is a serious argument realise that every word you say could read back to you in a court of law. Explain why you're angry (and hurt) and what you'd like to happen. Let that precious bitch moan back at you but stay on target. Bring the conversation back to a resolution and seek that compromise you were looking for. Apologise as needed and try to kiss and make up.,NULL,245,247,,"INSERT INTO FIX (order, heading, maintext, image, backvalue, nextvalue) VALUES (246, ""Let's talk...urgh"", ""Only consider this if both of you are calm. If not wait till you both are. If you are married or have been together for a long time and this is a serious argument realise that every word you say could read back to you in a court of law. Explain why you're angry (and hurt) and what you'd like to happen. Let that precious bitch moan back at you but stay on target. Bring the conversation back to a resolution and seek that compromise you were looking for. Apologise as needed and try to kiss and make up."", ""NULL"", ""245"", ""247"")",,,,,
72,300,Injustice sucks...I hate this sooooo much,It's just wrong! It's fucked! But it happened/is happening. What can I do to release this poisoned feeling?,injustice.png,NULL,301,,"INSERT INTO FIX (order, heading, maintext, image, backvalue, nextvalue) VALUES (300, ""Injustice sucks...I hate this sooooo much"", ""It's just wrong! It's fucked! But it happened/is happening. What can I do to release this poisoned feeling?"", ""injustice.png"", ""NULL"", ""301"")",,,,,
1065,247,Still pissed/butt hurt,For the real grudge holders consider if malice was truly invovled. As a general rule thoughtlessness requires an apology but actual malice requires restitution. Accept that you might not get either depending on the craziness/maturity of the person.,NULL,246,248,,"INSERT INTO FIX (order, heading, maintext, image, backvalue, nextvalue) VALUES (247, ""Still pissed/butt hurt"", ""For the real grudge holders consider if malice was truly invovled. As a general rule thoughtlessness requires an apology but actual malice requires restitution. Accept that you might not get either depending on the craziness/maturity of the person."", ""NULL"", ""246"", ""248"")",,,,,
1066,248,How to avoid this situation in future,Think of a few ways to avoid this and ask the other person if they have ideas too (the bastard probably has plenty but stay calm). Agree on at least one constructive thing you can both do to avoid this again - it helps you both recognise responsibility and the issue.,NULL,247,249,,"INSERT INTO FIX (order, heading, maintext, image, backvalue, nextvalue) VALUES (248, ""How to avoid this situation in future"", ""Think of a few ways to avoid this and ask the other person if they have ideas too (the bastard probably has plenty but stay calm). Agree on at least one constructive thing you can both do to avoid this again - it helps you both recognise responsibility and the issue."", ""NULL"", ""247"", ""249"")",,,,,
1067,249,Toxic Partners,If there truly is no resolution and you can't see the problem going away it's time to weight up just how healthy this relationship really is. Some people thrive on arguments but personally if I'm in a serious argument more than once every three months I think it's incompatible. It gets more complicated if kids are involved. Whatever you decide be kind to the other person.,NULL,248,250,,"INSERT INTO FIX (order, heading, maintext, image, backvalue, nextvalue) VALUES (249, ""Toxic Partners"", ""If there truly is no resolution and you can't see the problem going away it's time to weight up just how healthy this relationship really is. Some people thrive on arguments but personally if I'm in a serious argument more than once every three months I think it's incompatible. It gets more complicated if kids are involved. Whatever you decide be kind to the other person."", ""NULL"", ""248"", ""250"")",,,,,
1068,250,Calmed your tits?,Look anger can be horrible but it can be a really great motivator too if harnessed. Use this situation to recognise what needs to change and the anger as fuel to get you off your (ever expanding) ass and make it happen. Go make a change even if worst case it means changing partners. Don't involve friends if you can - they don't know shit about the situation and might have their own agendas.,smile.png,249,1,,"INSERT INTO FIX (order, heading, maintext, image, backvalue, nextvalue) VALUES (250, ""Calmed your tits?"", ""Look anger can be horrible but it can be a really great motivator too if harnessed. Use this situation to recognise what needs to change and the anger as fuel to get you off your (ever expanding) ass and make it happen. Go make a change even if worst case it means changing partners. Don't involve friends if you can - they don't know shit about the situation and might have their own agendas."", ""smile.png"", ""249"", ""1"")",,,,,
1069,301,Justice will bring peace!,If you can do something about it then it isn't worth stressing about it! Solve this! Do what you need to in order to fix it and if you can't do it alone enlist the help you need. You got this!,NULL,300,302,,"INSERT INTO FIX (order, heading, maintext, image, backvalue, nextvalue) VALUES (301, ""Justice will bring peace!"", ""If you can do something about it then it isn't worth stressing about it! Solve this! Do what you need to in order to fix it and if you can't do it alone enlist the help you need. You got this!"", ""NULL"", ""300"", ""302"")",,,,,
